{
  "$schema": "https://json-schema.org/draft/2020-12/schema",
  "$id": "https://chaos.local/schema/chaos-render/1/contract.schema.json",
  "title": "CHAOS Contract Record",
  "description": "The change contract as data: testable statements with stable ids (records/contract.json). Written at FRAME; later phases may amend it under stable ids (addedBy records who). Deliberately carries NO checkbox state and NO evidence - ticking is a render-time join against the latest deliver-pass coverage, which is what makes 'DELIVER ticks it only when covered by a test or a directly-evidenced check' a mechanical rule and current.contract a derived count that cannot go stale.",
  "type": "object",
  "additionalProperties": false,
  "required": ["schemaVersion", "recordType", "changeId", "sourceCommand", "run", "recordedAt", "statements"],
  "properties": {
    "schemaVersion": { "type": "integer", "const": 1 },
    "recordType": { "type": "string", "const": "contract" },
    "changeId": { "type": "string", "minLength": 1, "maxLength": 160 },
    "sourceCommand": { "type": "string", "pattern": "^chaos:[a-z-]+$" },
    "run": { "$ref": "#/$defs/runId" },
    "recordedAt": { "$ref": "#/$defs/timestamp" },
    "groups": {
      "type": "array",
      "description": "Render order of statement groups. A statement whose group is not listed here is a validation error (checked in code, not expressible in-schema).",
      "items": { "type": "string", "minLength": 1 }
    },
    "statements": {
      "type": "array",
      "minItems": 1,
      "items": {
        "type": "object",
        "additionalProperties": false,
        "required": ["id", "text"],
        "properties": {
          "id": { "$ref": "#/$defs/contractId" },
          "group": { "type": ["string", "null"] },
          "text": { "type": "string", "minLength": 1 },
          "source": {
            "type": "array",
            "description": "Decision entries that shaped this statement; validated against the ledger.",
            "items": { "$ref": "#/$defs/decisionRef" }
          },
          "addedBy": {
            "description": "Set when a phase after FRAME added this statement (e.g. a review remediation).",
            "oneOf": [{ "$ref": "#/$defs/decisionRef" }, { "type": "null" }]
          }
        }
      }
    }
  },
  "$defs": {
    "runId": { "type": "string", "pattern": "^RUN-[A-Za-z0-9][A-Za-z0-9-]*$" },
    "timestamp": { "type": "string", "pattern": "^\\d{4}-\\d{2}-\\d{2}T\\d{2}:\\d{2}:\\d{2}(\\.\\d{1,3})?Z$" },
    "contractId": { "type": "string", "pattern": "^C-\\d{3}$" },
    "decisionRef": {
      "type": "string",
      "pattern": "^((PROP|REV|APP|APPLY|VFY|VER|CR|SYNC|ARC|RETRO)-DEC-\\d{3}|ESC-\\d{3})$"
    }
  }
}
