{
  "schemaVersion": 1,
  "recordType": "contract",
  "changeId": "secure-task-api",
  "sourceCommand": "chaos:propose",
  "run": "RUN-2026-08-01-chaos-propose-secure-task-api-e2858e",
  "recordedAt": "2026-08-01T15:30:00Z",
  "groups": ["Authentication", "Edge hardening", "Governance / regression"],
  "statements": [
    { "id": "C-001", "group": "Authentication", "text": "Every `/tasks` route (`GET`, `GET /{id}`, `POST`, `PUT`, `DELETE`) returns `401` to a request with no `Authorization` header", "source": ["PROP-DEC-001", "PROP-DEC-004"] },
    { "id": "C-002", "group": "Authentication", "text": "A token with an invalid signature, an expired token, or a token with an unexpected issuer/audience each return `401`", "source": ["PROP-DEC-004"] },
    { "id": "C-003", "group": "Authentication", "text": "A request with a valid token reaches the existing handler and returns the same status/body it returns today", "source": ["PROP-DEC-004"] },
    { "id": "C-004", "group": "Authentication", "text": "`GET /` returns `200` unauthenticated as a liveness signal", "source": ["PROP-DEC-001"] },
    { "id": "C-005", "group": "Authentication", "text": "Signing key, issuer and audience come from configuration outside the repository; the app fails to start if any is missing, and no secret material is committed", "source": ["PROP-DEC-004"] },
    { "id": "C-006", "group": "Authentication", "text": "The dev-only issuance endpoint is registered **only** when the environment is Development **and** `Auth:EnableDevTokenEndpoint` is enabled; failing either gate it returns `404` because the route is never mapped, and the flag defaults to disabled (REV-DEC-003)", "source": ["REV-DEC-003"], "addedBy": "REV-DEC-003" },
    { "id": "C-007", "group": "Edge hardening", "text": "Exceeding the configured fixed-window rate limit on `/tasks` returns `429` and performs no mutation", "source": ["PROP-DEC-001", "PROP-DEC-002"] },
    { "id": "C-008", "group": "Edge hardening", "text": "An **unauthenticated** caller exceeding the limit receives `429`, not `401` — rejected requests consume permits, and `UseRateLimiter()` precedes authentication in the pipeline (REV-DEC-002)", "source": ["REV-DEC-002"], "addedBy": "REV-DEC-002" },
    { "id": "C-009", "group": "Edge hardening", "text": "`GET /` carries its own looser rate limit and returns `429` when exceeded", "source": ["REV-DEC-002"], "addedBy": "REV-DEC-002" },
    { "id": "C-010", "group": "Edge hardening", "text": "CORS is an explicit configured allow-list; no wildcard origin is combined with credentials", "source": ["PROP-DEC-002"] },
    { "id": "C-011", "group": "Edge hardening", "text": "`X-Content-Type-Options: nosniff` and a restrictive `Referrer-Policy` are present on every response, including `401`/`429`/`413`", "source": ["PROP-DEC-002"] },
    { "id": "C-012", "group": "Edge hardening", "text": "A request body over the configured maximum returns `413` and creates/modifies no task", "source": ["PROP-DEC-002"] },
    { "id": "C-013", "group": "Governance / regression", "text": "R-008 holds: `UseForwardedHeaders` is not registered at all, so no trusted-proxy set exists that could be left empty, and a caller-supplied `X-Forwarded-For` cannot influence the rate limiter's partition key", "source": ["PROP-DEC-005"] },
    { "id": "C-014", "group": "Governance / regression", "text": "R-003 holds: `dotnet build` and `dotnet test` are green, with the 5 baseline integration tests updated to authenticate rather than deleted" },
    { "id": "C-015", "group": "Governance / regression", "text": "R-004 holds: no auth or `Microsoft.AspNetCore.*` reference leaks into `Domain/**`" },
    { "id": "C-016", "group": "Governance / regression", "text": "R-005 holds: `TaskState` naming unchanged" },
    { "id": "C-017", "group": "Governance / regression", "text": "`docs/adr/2026-08-01-api-authentication-posture.md` records the auth posture, the rejected alternatives, and the upgrade path to an external IdP", "source": ["PROP-DEC-003", "PROP-DEC-004"] }
  ]
}
