{
  "schemaVersion": 1,
  "recordType": "contract",
  "changeId": "enforce-title-max-length",
  "sourceCommand": "chaos:run",
  "run": "RUN-2026-08-04-chaos-run-enforce-title-max-length",
  "recordedAt": "2026-08-03T23:41:29Z",
  "groups": [
    "Endpoint",
    "Invariants",
    "Non-regression"
  ],
  "statements": [
    {
      "id": "C-001",
      "group": "Endpoint",
      "text": "`POST /tasks` with a `title` longer than 200 characters is rejected with HTTP 400 Bad Request and no task is created."
    },
    {
      "id": "C-002",
      "group": "Endpoint",
      "text": "`PUT /tasks/{id}` with a `title` longer than 200 characters is rejected with HTTP 400 Bad Request and the stored task is not modified."
    },
    {
      "id": "C-003",
      "group": "Invariants",
      "text": "A `title` of exactly 200 characters is accepted: `POST /tasks` returns 201 Created and `PUT /tasks/{id}` returns 200 OK."
    },
    {
      "id": "C-004",
      "group": "Non-regression",
      "text": "The existing blank/whitespace `title` → HTTP 400 behaviour is preserved for both `POST /tasks` and `PUT /tasks/{id}`."
    },
    {
      "id": "C-005",
      "group": "Non-regression",
      "text": "Titles of normal length continue to work exactly as before, the other CRUD endpoints are unchanged, and `dotnet build` / the 5 baseline `dotnet test` cases stay green."
    }
  ]
}
