{
  "schemaVersion": 1,
  "recordType": "contract",
  "changeId": "task-count",
  "sourceCommand": "chaos:run",
  "run": "RUN-2026-08-04-chaos-run-task-count",
  "recordedAt": "2026-08-04T08:41:10Z",
  "groups": ["Endpoint", "Invariants", "Non-regression", "Boundary"],
  "statements": [
    {
      "id": "C-001",
      "group": "Endpoint",
      "text": "`GET /tasks/count` returns HTTP 200 with a JSON object `{ \"count\": <integer> }`, where `count` is the total number of tasks currently in the store."
    },
    {
      "id": "C-002",
      "group": "Invariants",
      "text": "`count` equals the number of items returned by `GET /tasks` for the same store at the same moment."
    },
    {
      "id": "C-003",
      "group": "Invariants",
      "text": "Creating a task (`POST /tasks` → 201) increases `count` by exactly 1."
    },
    {
      "id": "C-004",
      "group": "Invariants",
      "text": "Deleting a task (`DELETE /tasks/{id}` → 204) decreases `count` by exactly 1."
    },
    {
      "id": "C-005",
      "group": "Non-regression",
      "text": "The root health endpoint `GET /` and all existing `/tasks` CRUD behaviour are unchanged: the 5 baseline tests still pass and `dotnet build` stays green (R-003)."
    },
    {
      "id": "C-006",
      "group": "Boundary",
      "text": "The change touches only `src/TaskTracker.Api` and `tests/TaskTracker.Tests`, keeping the domain→HTTP direction (R-004) and the `TaskState` naming (R-005) intact."
    }
  ]
}
