{
  "schemaVersion": 1,
  "recordType": "contract",
  "changeId": "soft-delete-tasks",
  "sourceCommand": "chaos:run",
  "run": "RUN-2026-08-04-chaos-run-soft-delete-tasks",
  "recordedAt": "2026-08-04T00:00:00Z",
  "groups": ["Model", "Delete", "Read", "Compatibility", "Non-regression"],
  "statements": [
    {
      "id": "C-001",
      "group": "Model",
      "text": "The task model carries a nullable `deletedAt` timestamp, serialized in JSON as `deletedAt`: an ISO-8601 string when the task is soft-deleted, and `null` when the task is active."
    },
    {
      "id": "C-002",
      "group": "Delete",
      "text": "`DELETE /tasks/{id}` on an existing active task soft-deletes it — it sets `deletedAt` to the current time and returns `204 No Content`."
    },
    {
      "id": "C-003",
      "group": "Delete",
      "text": "`DELETE /tasks/{id}` does not permanently remove the task: after a successful delete the task is still retained in the store and is reachable via `GET /tasks?includeDeleted=true` with a non-null `deletedAt`."
    },
    {
      "id": "C-004",
      "group": "Delete",
      "text": "`DELETE /tasks/{id}` for an id that does not identify a known task returns `404 Not Found`."
    },
    {
      "id": "C-005",
      "group": "Read",
      "text": "`GET /tasks` returns only active (not soft-deleted) tasks by default."
    },
    {
      "id": "C-006",
      "group": "Read",
      "text": "`GET /tasks?includeDeleted=true` returns all tasks, including soft-deleted ones (whose `deletedAt` is non-null)."
    },
    {
      "id": "C-007",
      "group": "Read",
      "text": "`GET /tasks/{id}` returns `404 Not Found` for a soft-deleted task."
    },
    {
      "id": "C-008",
      "group": "Compatibility",
      "text": "The four tasks seeded at startup remain active after startup — each serializes `deletedAt` as `null` — so existing rows keep working without a migration step."
    },
    {
      "id": "C-009",
      "group": "Non-regression",
      "text": "`dotnet build` and `dotnet test` stay green, and the five pre-existing integration tests still pass (R-003)."
    },
    {
      "id": "C-010",
      "group": "Non-regression",
      "text": "No unrelated behaviour of the other CRUD endpoints changes: `POST /tasks`, `PUT /tasks/{id}` and the blank-title `400` validation keep their existing contracts."
    },
    {
      "id": "C-011",
      "group": "Non-regression",
      "text": "The boundary direction and naming rules hold: `Domain/**` references no ASP.NET type (R-004) and the work-item enum stays named `TaskState` (R-005)."
    },
    {
      "id": "C-012",
      "group": "Delete",
      "text": "`DELETE /tasks/{id}` for a task that is already soft-deleted returns `404 Not Found` and leaves the original `deletedAt` unchanged.",
      "addedBy": "RUN-DEC-002"
    },
    {
      "id": "C-013",
      "group": "Read",
      "text": "`PUT /tasks/{id}` returns `404 Not Found` for a soft-deleted task and does not modify it; its behaviour toward active tasks is unchanged.",
      "addedBy": "RUN-DEC-002"
    }
  ]
}
