{
  "schemaVersion": 1,
  "recordType": "contract",
  "changeId": "example-change",
  "sourceCommand": "chaos:run",
  "run": "RUN-2026-01-01-chaos-run-example-change-abc123",
  "recordedAt": "2026-01-01T12:00:00Z",
  "groups": ["Endpoint", "Invariants", "Non-regression"],
  "statements": [
    {
      "id": "C-001",
      "group": "Endpoint",
      "text": "`GET /widgets/summary` returns HTTP 200 with a JSON object `{ \"total\": <integer> }`."
    },
    {
      "id": "C-002",
      "group": "Invariants",
      "text": "`total` equals the number of items returned by `GET /widgets` for the same store at the same moment."
    },
    {
      "id": "C-003",
      "group": "Non-regression",
      "text": "All existing `/widgets` behaviour is unchanged: the baseline tests still pass and the build stays green."
    },
    {
      "id": "C-004",
      "group": "Invariants",
      "text": "A statement added after framing carries `addedBy` naming the decision that introduced it.",
      "addedBy": "RUN-DEC-002"
    }
  ]
}
